{
  "id": "TL-0093",
  "record_type": "event",
  "timeline_status": "integrated",
  "date": {
    "start": "2025-12",
    "end": null,
    "precision": "month"
  },
  "title": {
    "it": "National Security Strategy degli Stati Uniti"
  },
  "description": {
    "it": "La strategia ufficiale esprime l’obiettivo di favorire cambiamenti nella traiettoria politica europea e un rapporto più stabile con Mosca; non prova un’operazione clandestina."
  },
  "category": {
    "it": "Strategia USA / Europa"
  },
  "themes": [
    "geopolitics_diplomacy"
  ],
  "geography": {
    "it": "USA / Europa"
  },
  "evidence_note": {
    "it": "Documento ufficiale, intenzione dichiarata"
  },
  "evidence_level": null,
  "publisher": null,
  "url": null,
  "sources": [
    "S00",
    "S05"
  ],
  "known_issues": [],
  "review": {
    "status": "imported_unreviewed",
    "notes": []
  },
  "provenance": [
    {
      "file": "sources/original/Fonte_06_Timeline_Cronologica_Eventi_Documentati_Europa_2007-2026_2026-10-21.csv",
      "row": 93,
      "original": {
        "id": "TL-0093",
        "date_start": "2025-12",
        "date_end": "",
        "date_precision": "month",
        "category": "Strategia USA / Europa",
        "title": "National Security Strategy degli Stati Uniti",
        "description": "La strategia ufficiale esprime l’obiettivo di favorire cambiamenti nella traiettoria politica europea e un rapporto più stabile con Mosca; non prova un’operazione clandestina.",
        "evidence_status": "Documento ufficiale, intenzione dichiarata",
        "source_docs": "S00,S05",
        "geography": "USA / Europa"
      }
    },
    {
      "file": "sources/original/Fonte_07_Ragnatela_Attori_Interessi_Relazioni_Europa_2026-10-21_nodi.csv",
      "row": 295,
      "original": {
        "id": "EV_TL-0093",
        "name": "National Security Strategy degli Stati Uniti",
        "kind": "event",
        "domain": "Strategia USA / Europa",
        "geo": "USA / Europa",
        "date_start": "2025-12",
        "date_end": "",
        "date_precision": "month",
        "source_docs": "S06,S00;S05",
        "evidence_status": "Documento ufficiale, intenzione dichiarata",
        "note": "Record originale TL-0093; La strategia ufficiale esprime l’obiettivo di favorire cambiamenti nella traiettoria politica europea e un rapporto più stabile con Mosca; non prova un’operazione clandestina."
      }
    }
  ]
}
