{
  "id": "TL-0142",
  "record_type": "event",
  "timeline_status": "integrated",
  "date": {
    "start": "2026-10-16",
    "end": null,
    "precision": "day"
  },
  "title": {
    "it": "Prime ricostruzioni pubbliche delle restrizioni Starshield"
  },
  "description": {
    "it": "AP/Reuters riportano limitazioni e attribuzioni iniziali interne alla Casa Bianca; Telegraph descrive ruolo propositivo di Musk. Versioni divergenti."
  },
  "category": {
    "it": "Satelliti / intelligence"
  },
  "themes": [
    "infrastructure_space",
    "intelligence"
  ],
  "geography": {
    "it": "Ucraina / Stati Uniti"
  },
  "evidence_note": {
    "it": "Reporting giornalistico; responsabilità contestata"
  },
  "evidence_level": null,
  "publisher": null,
  "url": null,
  "sources": [
    "S00",
    "S03",
    "S05"
  ],
  "known_issues": [],
  "review": {
    "status": "imported_unreviewed",
    "notes": []
  },
  "provenance": [
    {
      "file": "sources/original/Fonte_06_Timeline_Cronologica_Eventi_Documentati_Europa_2007-2026_2026-10-21.csv",
      "row": 142,
      "original": {
        "id": "TL-0142",
        "date_start": "2026-10-16",
        "date_end": "",
        "date_precision": "day",
        "category": "Satelliti / intelligence",
        "title": "Prime ricostruzioni pubbliche delle restrizioni Starshield",
        "description": "AP/Reuters riportano limitazioni e attribuzioni iniziali interne alla Casa Bianca; Telegraph descrive ruolo propositivo di Musk. Versioni divergenti.",
        "evidence_status": "Reporting giornalistico; responsabilità contestata",
        "source_docs": "S00,S03,S05",
        "geography": "Ucraina / Stati Uniti"
      }
    },
    {
      "file": "sources/original/Fonte_07_Ragnatela_Attori_Interessi_Relazioni_Europa_2026-10-21_nodi.csv",
      "row": 344,
      "original": {
        "id": "EV_TL-0142",
        "name": "Prime ricostruzioni pubbliche delle restrizioni Starshield",
        "kind": "event",
        "domain": "Satelliti / intelligence",
        "geo": "Ucraina / Stati Uniti",
        "date_start": "2026-10-16",
        "date_end": "",
        "date_precision": "day",
        "source_docs": "S06,S00;S03;S05",
        "evidence_status": "Reporting giornalistico; responsabilità contestata",
        "note": "Record originale TL-0142; AP/Reuters riportano limitazioni e attribuzioni iniziali interne alla Casa Bianca; Telegraph descrive ruolo propositivo di Musk. Versioni divergenti."
      }
    }
  ]
}
