{
  "id": "TL-0133",
  "record_type": "event",
  "timeline_status": "integrated",
  "date": {
    "start": "2026-10",
    "end": null,
    "precision": "month"
  },
  "title": {
    "it": "Nuove sanzioni USA contro CPI e reazione UE"
  },
  "description": {
    "it": "Nel mese di ottobre Washington estende misure restrittive, mentre l’UE riafferma il sostegno all’indipendenza della Corte."
  },
  "category": {
    "it": "Diplomazia / CPI"
  },
  "themes": [
    "geopolitics_diplomacy",
    "justice"
  ],
  "geography": {
    "it": "Stati Uniti / Unione europea"
  },
  "evidence_note": {
    "it": "Atti e posizioni ufficiali; giorno non specificato"
  },
  "evidence_level": null,
  "publisher": null,
  "url": null,
  "sources": [
    "S00",
    "S05"
  ],
  "known_issues": [],
  "review": {
    "status": "imported_unreviewed",
    "notes": []
  },
  "provenance": [
    {
      "file": "sources/original/Fonte_06_Timeline_Cronologica_Eventi_Documentati_Europa_2007-2026_2026-10-21.csv",
      "row": 133,
      "original": {
        "id": "TL-0133",
        "date_start": "2026-10",
        "date_end": "",
        "date_precision": "month",
        "category": "Diplomazia / CPI",
        "title": "Nuove sanzioni USA contro CPI e reazione UE",
        "description": "Nel mese di ottobre Washington estende misure restrittive, mentre l’UE riafferma il sostegno all’indipendenza della Corte.",
        "evidence_status": "Atti e posizioni ufficiali; giorno non specificato",
        "source_docs": "S00,S05",
        "geography": "Stati Uniti / Unione europea"
      }
    },
    {
      "file": "sources/original/Fonte_07_Ragnatela_Attori_Interessi_Relazioni_Europa_2026-10-21_nodi.csv",
      "row": 335,
      "original": {
        "id": "EV_TL-0133",
        "name": "Nuove sanzioni USA contro CPI e reazione UE",
        "kind": "event",
        "domain": "Diplomazia / CPI",
        "geo": "Stati Uniti / Unione europea",
        "date_start": "2026-10",
        "date_end": "",
        "date_precision": "month",
        "source_docs": "S06,S00;S05",
        "evidence_status": "Atti e posizioni ufficiali; giorno non specificato",
        "note": "Record originale TL-0133; Nel mese di ottobre Washington estende misure restrittive, mentre l’UE riafferma il sostegno all’indipendenza della Corte."
      }
    }
  ]
}
